disease,Description,Cause,Management
sickle cell disease,"A genetic disorder that causes red blood cells to become abnormally shaped, leading to pain, anemia, and potential organ damage.",Genetic mutation leading to abnormal hemoglobin that causes red blood cells to sickle.,"Pain management, hydroxyurea, blood transfusions, and supportive care; bone marrow transplant may be considered in select cases."
skin cancer,"Cancer that forms in the skin cells, often appearing as growths or lesions. Types include melanoma, basal cell carcinoma, and squamous cell carcinoma.","Primarily due to UV radiation exposure and genetic predisposition; includes melanoma, basal cell, and squamous cell carcinomas.","Treatments range from surgical excision to topical therapies, cryotherapy, radiation, and systemic therapies for advanced cases."
stomach cancer,"Cancer of the stomach, leading to symptoms like abdominal pain, bloating, and loss of appetite.","Associated with chronic H. pylori infection, high-salt diets, smoking, and genetic factors.","Managed with surgical resection, chemotherapy, and radiation therapy, often in combination."
thrombocytopenia,"A condition where there is a low platelet count, leading to symptoms like easy bruising, excessive bleeding, and petechiae.","Low platelet count due to various causes including autoimmune disorders, medications, or bone marrow problems.","Treat the underlying cause, corticosteroids, platelet transfusions, and supportive care as needed."
urinary schistosomiasis,"A parasitic infection caused by Schistosoma worms, leading to symptoms like blood in the urine, abdominal pain, and urinary frequency.",Parasitic infection by Schistosoma haematobium from contact with contaminated freshwater.,Treatment with praziquantel and improvements in sanitation and water quality to prevent reinfection.
acne,"A skin condition characterized by pimples, blackheads, and cysts, often occurring in adolescence but can affect people of all ages.","Inflammatory condition due to clogged hair follicles, bacteria, and hormonal influences.","Topical retinoids, antibiotics, benzoyl peroxide, and in severe cases, oral medications (antibiotics or isotretinoin)."
allergic rhinitis,"An allergic reaction to airborne particles like pollen, causing symptoms like sneezing, nasal congestion, and itchy eyes.","Allergic response to airborne allergens (pollen, dust mites, pet dander).","Antihistamines, nasal corticosteroids, decongestants, and allergen avoidance; immunotherapy may be considered."
athleteâ€™s foot,"A fungal infection that affects the skin on the feet, causing itching, redness, and peeling.",Fungal infection (tinea pedis) commonly due to dermatophytes thriving in moist environments.,Topical antifungal creams or powders; keep feet clean and dry; severe cases may require oral antifungals.
boils,"Painful, pus-filled bumps that form under the skin when hair follicles become infected.",Bacterial infection (usually Staphylococcus aureus) of hair follicles or oil glands.,"Warm compresses, incision and drainage if necessary, and antibiotics for extensive or recurrent infections."
canker sores,"Small, painful ulcers that appear inside the mouth, often triggered by stress, certain foods, or trauma.","Painful oral ulcers triggered by stress, minor trauma, or certain foods.","Topical corticosteroids, analgesic mouthwashes, and maintaining good oral hygiene; usually self-resolving."
conjunctivitis,"Also known as pink eye, it is an infection or inflammation of the eye's conjunctiva, causing redness, itching, and discharge.","Inflammation of the conjunctiva due to viral, bacterial, or allergic causes.","Antibiotic eye drops (for bacterial), supportive care (for viral), antihistamines (for allergic), and proper hygiene."
constipation,"Difficulty or infrequent bowel movements, often causing discomfort, bloating, and abdominal pain.","Often due to low dietary fiber, dehydration, sedentary lifestyle, or certain medications.","Increased fiber and fluid intake, regular exercise, and laxatives if necessary under medical guidance."
corns and calluses,"Thickened skin that forms due to pressure or friction, typically on the feet or hands.",Thickened skin from repeated friction or pressure (commonly on the feet).,"Protective padding, gentle removal with a pumice stone, proper footwear; severe cases may require professional care."
dandruff,"Flaky, dry skin on the scalp, often accompanied by itching.",Often related to seborrheic dermatitis or dry scalp conditions.,"Use of anti-dandruff shampoos (containing zinc pyrithione, ketoconazole, or selenium sulfide) and scalp care."
dehydration,"A condition caused by excessive loss of water from the body, leading to symptoms like dry mouth, fatigue, and dizziness.","Loss of body fluids from inadequate intake, excessive sweating, vomiting, or diarrhea.",Rehydration with fluids and electrolytes (oral rehydration solutions or IV fluids in severe cases) and treating the underlying cause.
dermatitis,"Inflammation of the skin, causing redness, itching, and sometimes blisters.","Inflammation of the skin due to irritants, allergens, or genetic predisposition.","Topical corticosteroids, moisturizers, and avoidance of known triggers."
diarrhea,"Frequent, loose, and watery stools, often caused by infection, food intolerance, or gastrointestinal disorders.","Often caused by infections (viral, bacterial, parasitic), food poisoning, or medication side effects.","Rehydration (oral rehydration solutions), dietary modifications, and antibiotics if a bacterial cause is confirmed."
ear infection,"An infection of the middle ear, leading to pain, hearing loss, and sometimes fever.","Bacterial or viral infection of the middle ear, common in children.","Pain management (analgesics), sometimes antibiotics, and warm compresses; maintain proper ear hygiene."
flatulence,"Excessive gas in the digestive system, leading to bloating, belching, and passing gas.",Excess gas from swallowed air or the breakdown of certain foods by gut bacteria.,"Dietary modifications, slower eating habits, and over-the-counter anti-gas medications (e.g., simethicone)."
food poisoning,"An illness caused by consuming contaminated food or water, leading to symptoms like vomiting, diarrhea, and stomach cramps.","Ingestion of food contaminated with bacteria, viruses, parasites, or toxins.","Supportive care with rehydration, rest, and, when appropriate, antibiotics; prevention via safe food handling practices."
fungal infections,"Infections caused by fungi, often affecting the skin, nails, or lungs.","Infections caused by fungi in warm, moist environments (skin, nails, etc.).",Topical or oral antifungal medications; keeping affected areas clean and dry is essential.
gastritis,"Inflammation of the stomach lining, often causing nausea, vomiting, and stomach pain.","Inflammation of the stomach lining due to H. pylori infection, alcohol use, or NSAIDs.","Use of antacids, proton pump inhibitors or H2 blockers, and antibiotics when H. pylori is present; dietary adjustments."
"hand, foot, and mouth disease","A viral infection commonly affecting children, causing fever, mouth sores, and a rash on the hands and feet.",Viral infection (commonly coxsackievirus) affecting mainly children.,"Supportive care (hydration, pain management), fever reducers, and isolation during the contagious period."
heartburn,"A burning sensation in the chest caused by acid reflux, where stomach acid backs up into the esophagus.",Acid reflux from a weakened lower esophageal sphincter or dietary triggers.,"Antacids, H2 blockers, proton pump inhibitors, and lifestyle modifications (avoiding trigger foods, not eating late at night)."
heat rash,"A rash caused by sweating in hot and humid conditions, leading to small red bumps and discomfort.","Blocked sweat ducts in hot, humid conditions leading to skin irritation.","Cooling measures, loose clothing, topical calamine or hydrocortisone creams, and keeping the skin dry."
hemorrhoids,"Swollen blood vessels in the rectum, often causing pain, bleeding, and itching.","Swollen veins in the rectal area due to straining, constipation, or pregnancy.","High-fiber diet, sitz baths, topical treatments, and in severe cases, procedural interventions."
hives,"Red, itchy welts that appear on the skin, often triggered by allergies, stress, or infections.","Allergic reaction causing raised, itchy welts from histamine release.","Antihistamines, corticosteroids for severe cases, and avoidance of known allergens."
indigestion,"Discomfort or pain in the stomach, often caused by overeating, eating spicy foods, or stress.",Discomfort from overeating or consuming fatty/spicy foods.,"Antacids, dietary adjustments, and stress management; sometimes prokinetic agents are used."
ingrown toenails,"Condition where the edge of a toenail grows into the surrounding skin, causing pain and potential infection.",Nail edge grows into the surrounding skin due to improper trimming or tight footwear.,"Soaking in warm water, proper nail trimming techniques, and, if necessary, minor surgical intervention."
jock itch,"A fungal infection that causes itching, redness, and irritation in the groin area.","Fungal infection in the groin area, exacerbated by warmth and moisture.","Topical antifungal creams, keeping the area clean and dry, and avoiding tight clothing."
lice infestation,"A parasitic infection caused by lice, leading to itching and discomfort, typically affecting the scalp, body, or pubic region.",Parasitic infestation (often scalp lice) transmitted through close contact.,"Over-the-counter or prescription lice treatments (shampoos, lotions), combing to remove nits, and treating close contacts."
mild sunburn,Skin redness and irritation caused by overexposure to sunlight.,Skin inflammation due to overexposure to UV radiation.,"Cool compresses, moisturizers (preferably aloe vera), pain relievers, and avoiding further sun exposure."
nasal congestion,"Blockage of the nasal passages, often caused by colds, allergies, or sinus infections.","Inflammation of nasal passages from infections, allergies, or irritants.","Saline nasal sprays, decongestants, antihistamines, and steam inhalation."
nosebleeds,"Bleeding from the nose, often caused by dryness, trauma, or underlying health conditions.","Rupture of small nasal blood vessels, often from dry air or minor trauma.","Pinching the nostrils, leaning forward, cold compresses, and humidifying indoor air; seek care if recurrent."
oral thrush,"A fungal infection in the mouth caused by Candida, leading to white patches on the tongue and inside the cheeks.","Overgrowth of Candida in the mouth, common in infants or immunocompromised individuals.","Topical or oral antifungal medications (e.g., nystatin, clotrimazole) and improved oral hygiene."
pityriasis versicolor,"A fungal infection of the skin that causes discolored patches, often on the chest, back, and arms.",Superficial fungal infection (Malassezia species) causing skin discoloration.,"Topical antifungal treatments (selenium sulfide, ketoconazole) and maintaining a dry, clean skin environment."
sore throat,"Pain or irritation in the throat, often caused by viral infections, bacterial infections, or environmental factors.",Inflammation of the throat due to viral or bacterial infections.,"Throat lozenges, warm salt water gargles, pain relievers, and antibiotics if a bacterial cause is confirmed."
styes,"Painful, swollen bumps on the eyelid caused by an infected eyelash follicle or oil gland.",Bacterial infection of an eyelid gland (often Staphylococcus aureus).,"Warm compresses, proper eyelid hygiene, and antibiotic ointments or oral antibiotics if necessary."
tooth decay,"The destruction of tooth structure caused by bacteria, leading to cavities, pain, and possible tooth loss.",Destruction of tooth enamel by acids produced from plaque bacteria.,"Dental treatments (fillings, crowns, root canals) and preventive care (brushing, flossing, fluoride toothpaste)."
warts,"Small growths on the skin caused by the human papillomavirus (HPV), typically appearing on the hands, feet, or face.",Skin growths caused by human papillomavirus (HPV) infection.,"Topical salicylic acid, cryotherapy, or other dermatologic removal methods; avoid picking to prevent spread."
