disease,Diet Plan,Additional Information
mild sunburn,"Eat antioxidant-rich food (berries , spinach) to reduce inflammation",Caused by overexposure to UV rays treated with cooling skin treatments
nasal congestion,"Include spicy food (chili peppers , ginger) to clear sinuses ;stay hydrated",Often caused by colds/allergies treated with decongestants/nasal sprays
nosebleeds,"Consume vitamin C-rich food (oranges , strawberries) to strengthen blood vessels","Caused by dry air , trauma or underlying conditions treated by applying pressure/keeping head elevated"
oral thrush,"Eat probiotics (yogurt,kefir) to restore healthy gut flora ;avoid sugary food",Fungal infection caused by Candida treated with antifungal medications
pityriasis versicolor,"Include antifungal food (garlic,turmeric);avoid sugar&processed food",Fungal infection causing discolored patches treated with antifungal creams/shampoos
sore throat,"Consume warm soothing food (soups,honey);avoid spicy&acidic food","Often caused by viral infections treated with rest,hyration&over-the-counter pain relievers"
styes,"Focus on vitamin A&zinc-rich food (carrots,pumpkin seeds);avoid sugary&processed food",Infections of eyelid glands treated with warm compresses&good eyelid hygiene
tooth decay,"Include calcium-rich food (dairy , leafy greens) to strengthen teeth ;avoid sugary&acidic food",Caused by bacteria breaking down sugars in mouth prevented through regular brushing/flossing/dental checkups
warts,"Eat vitamin C&zinc-rich food(citrus fruits,nuts) to boost immunity","Caused by human papillomavirus(HPV);treatment includes topical medications ,cryotherapy or surgical removal"
